{
  "id": "SBX-015",
  "title": "Synthetic record carrying unsafe and ordinary markdown links",
  "type": "improvement",
  "severity": "low",
  "status": "open",
  "foundBy": "fixture author, for the viewer's link-safety check",
  "opened": "2026-08-26",
  "resolved": null,
  "stint": null,
  "evidence": {
    "commits": [],
    "integrated": [],
    "verified": null
  },
  "resolution": null,
  "details": "This record exists so the fixture suite can watch what the markdown viewer does with link schemes. It names [the safe link](https://example.com/sandbox/spec) next to [the js link](javascript:alert(1)) and [the data link](data:text/html;base64,PHQ+PGk+dW5zYWZlPC9pPjwvdD4=) on purpose: the first must keep its href, the other two must lose theirs.",
  "notes": [],
  "links": []
}
