{
  "id": "LGR-014",
  "title": "The CI status reports workflows as running long after they finish",
  "type": "defect",
  "severity": "med",
  "status": "in-progress",
  "foundBy": "repository owner, reading the CI dashboard: \"The ledger, ui, lint, and sandbox projects all show their CI status as running, even though they completed.\"",
  "opened": "2026-09-15",
  "resolved": null,
  "stint": "2026-09-15 CI status reported as running",
  "evidence": {
    "commits": [],
    "integrated": [],
    "verified": null
  },
  "resolution": null,
  "details": "`pages.yml` writes `ci-status.json` when ci finishes, and npm and publish images start at that same moment. The file is written within half a minute, so it records both runs as in progress. Nothing rewrites it until the next push, so the dashboard at codesweep.ai/dashboards/ci shows this repository as running from then on.\n\nOn aea7032, ci finished at 17:45:49 and all three workflows started at 17:45:51. The file was generated at 17:46:10. publish images finished at 17:46:42 and npm at 17:47:06. The status action leaves out only the run writing the file, so the other two are reported as unfinished.\n\nIt began when npm and publish images moved to start on ci's completion, in 3354c4e and aea7032. The comment in `pages.yml` expected such a run to be a few minutes behind. It is reported as running instead, until the next push repeats the same race.",
  "notes": [],
  "links": []
}
