{
  "id": "LGR-019",
  "title": "make repin pins a sibling's tip whether or not its CI passed",
  "type": "improvement",
  "severity": "low",
  "status": "in-progress",
  "foundBy": "user report (host): \"If I wanted make repin to look for the last green built commit, could this just work with curl?\"",
  "opened": "2026-09-23",
  "resolved": null,
  "stint": "last-green-pins",
  "evidence": {
    "commits": [],
    "integrated": [],
    "verified": null
  },
  "resolution": null,
  "details": "`make repin` moves every codesweep-ai tool pin to its sibling's main with `go get …@main`. The tip of main may be a commit whose CI failed, one still building, or one that changed only the ledger and was never built. The status file each project publishes now names the newest commit its CI built and passed, as `built`. `make repin` pins that commit, and falls back to the tip where the file names none.",
  "notes": [],
  "links": []
}
