{
  "id": "LGR-009",
  "title": "The first install route pointed at a releases page with nothing on it",
  "type": "defect",
  "severity": "med",
  "status": "open",
  "foundBy": "session agent, following README.md and INSTALL.md as a first-time reader",
  "opened": "2026-08-17",
  "resolved": null,
  "stint": "2026-08-17 documentation walkthrough",
  "evidence": {
    "commits": [],
    "integrated": [],
    "verified": null
  },
  "resolution": null,
  "details": "INSTALL.md \u00a71 leads with \"Download a release\": fetch the archive and `checksums.txt`, verify the checksum, then the cosign signature. `gh release list` returns nothing, because no v* tag has been pushed and `.github/workflows/release.yml` fires on a tag.\n\nA first-time reader takes the first route offered and finds an empty page.\n\nCutting the first tag makes the whole section true. Until then the page says so, which is what the tracer repository already does.",
  "notes": [],
  "links": []
}
